{
  "schema_version": "article_bundle.v1",
  "notice_id": "352044",
  "title": "讲座预告| 9月18日 考公系列讲座2——《解密选调生，从报考到发展》",
  "source_url": "https://my.muc.edu.cn/notice/352044",
  "published_at": "2025-09-11 17:06",
  "content_type": "mixed",
  "clean_text": "同学们！准备好参加考公了吗？前公务员考官、考公规划专家来助力咱们上岸啦！一、讲座时间：9月18日（周四）晚19:00二、讲座地点：海淀校区，文华楼西0406三、讲座内容：选调生的历史发展及重点选调计划介绍。现场能领《手把手教你规划考公上岸》（先到先得），现场可1V1咨询。四、主讲人介绍：孙志超老师，北京大学光华管理学院硕士研究生。前组织、宣传、团口公务员，曾任公务员、事业单位面试考官，参与试题命制与阅卷；国聘行动公考首席规划师。考公关键期，别错过这场公益讲座，快来找准上岸路！支持腾讯会议线上收听。",
  "asset_refs": [
    {
      "asset_id": "352044-poster-01",
      "kind": "poster",
      "local_ref": "private://352044/poster-01",
      "sha256": "2affaaea45f1ed49c53af3839977568cfac53e25aeb060b11e6849b63f5d1cb5"
    }
  ],
  "fetch_status": "processed",
  "failure_reason": null,
  "fetched_at": "2026-09-18T00:36:59+08:00"
}