{
  "schema_version": "article_bundle.v1",
  "notice_id": "manual-xinjiang-0314",
  "title": "3月14日||\"共美\"沙龙—新疆维吾尔自治区定向选调经验分享",
  "source_url": "manual://manual-xinjiang-0314",
  "published_at": "2024-03-07 10:42",
  "content_type": "poster",
  "clean_text": null,
  "asset_refs": [
    {
      "asset_id": "manual-xinjiang-0314-poster-01",
      "kind": "poster",
      "local_ref": "private://manual-xinjiang-0314/poster-01",
      "sha256": "36494aaa525a903a7f3c72cdbaced3b777b790119453815575556c972ec9bb7b"
    }
  ],
  "fetch_status": "processed",
  "failure_reason": null,
  "fetched_at": "2026-09-19T18:00:00+08:00"
}