{
  "schema_version": "article_bundle.v1",
  "notice_id": "247509",
  "title": "12月26日||闪耀基层——辽宁选调校友经验分享活动",
  "source_url": "https://my.muc.edu.cn/notice/247509",
  "published_at": "2026-09-18T22:19:12+08:00",
  "content_type": "poster",
  "clean_text": null,
  "asset_refs": [
    {
      "asset_id": "247509-poster-01",
      "kind": "poster",
      "local_ref": "private://247509/poster-01",
      "sha256": "064246b707037fb65dfbf556ad0054926a86b5a1012a7a27c160400a7ae9d8c9"
    }
  ],
  "fetch_status": "processed",
  "failure_reason": null,
  "fetched_at": "2026-09-19T18:00:00+08:00"
}