{
  "schema_version": "article_bundle.v1",
  "notice_id": "246951",
  "title": "11月27日|| MUC“共美”沙龙——湖南选调经验分享",
  "source_url": "https://my.muc.edu.cn/notice/246951",
  "published_at": "2026-09-18T22:19:13+08:00",
  "content_type": "poster",
  "clean_text": null,
  "asset_refs": [
    {
      "asset_id": "246951-poster-01",
      "kind": "poster",
      "local_ref": "private://246951/poster-01",
      "sha256": "192b05da923c43ad71276424ed48e778228a8d87f78a7ec29801b738c10526e8"
    }
  ],
  "fetch_status": "processed",
  "failure_reason": null,
  "fetched_at": "2026-09-19T18:00:00+08:00"
}