{
  "schema_version": "article_bundle.v1",
  "notice_id": "247919",
  "title": "1月13日||闪耀基层——河北定向选调经验分享",
  "source_url": "https://my.muc.edu.cn/notice/247919",
  "published_at": "2026-09-18T22:19:12+08:00",
  "content_type": "poster",
  "clean_text": null,
  "asset_refs": [
    {
      "asset_id": "247919-poster-01",
      "kind": "poster",
      "local_ref": "private://247919/poster-01",
      "sha256": "21aaf2403d71f165d810f95a1247335ba785ed4990cea052ac67ed9a2cefe69c"
    }
  ],
  "fetch_status": "processed",
  "failure_reason": null,
  "fetched_at": "2026-09-19T18:00:00+08:00"
}