{
  "schema_version": "article_bundle.v1",
  "notice_id": "246323",
  "title": "10月28日||MUC“共美”沙龙—青海定向选调经验分享",
  "source_url": "https://my.muc.edu.cn/notice/246323",
  "published_at": "2026-09-18T22:19:14+08:00",
  "content_type": "poster",
  "clean_text": null,
  "asset_refs": [
    {
      "asset_id": "246323-poster-01",
      "kind": "poster",
      "local_ref": "private://246323/poster-01",
      "sha256": "e24e643770f2a297edd3c6e045d25389f7db7bbceeaa663324834136e47b2e6b"
    }
  ],
  "fetch_status": "processed",
  "failure_reason": null,
  "fetched_at": "2026-09-19T18:00:00+08:00"
}