{
  "schema_version": "article_bundle.v1",
  "notice_id": "247339",
  "title": "12月12日||“闪耀基层”——广东定向选调经验分享",
  "source_url": "https://my.muc.edu.cn/notice/247339",
  "published_at": "2026-09-18T22:19:12+08:00",
  "content_type": "poster",
  "clean_text": null,
  "asset_refs": [
    {
      "asset_id": "247339-poster-01",
      "kind": "poster",
      "local_ref": "private://247339/poster-01",
      "sha256": "e48401634cdcfac6c2f92e4033253eb6cb711c5824fd8d3dff35e6c2cbbfa79f"
    }
  ],
  "fetch_status": "processed",
  "failure_reason": null,
  "fetched_at": "2026-09-19T18:00:00+08:00"
}