{
  "schema_version": "article_bundle.v1",
  "notice_id": "manual-shanxi-1227",
  "title": "12月27日||\"共美\"沙龙——山西定向选调经验分享",
  "source_url": "manual://manual-shanxi-1227",
  "published_at": "2023-12-22 19:23",
  "content_type": "poster",
  "clean_text": null,
  "asset_refs": [
    {
      "asset_id": "manual-shanxi-1227-poster-01",
      "kind": "poster",
      "local_ref": "private://manual-shanxi-1227/poster-01",
      "sha256": "130d6a57b214ff4446b5ac00623fe3e2f6b8ef112c29a6b0971b3f9a65236522"
    }
  ],
  "fetch_status": "processed",
  "failure_reason": null,
  "fetched_at": "2026-09-19T18:00:00+08:00"
}