{
  "schema_version": "article_bundle.v1",
  "notice_id": "247586",
  "title": "12月23日||\"闪耀基层\"——新疆维吾尔自治区定向选调经验分享",
  "source_url": "https://my.muc.edu.cn/notice/247586",
  "published_at": "2026-09-18T22:19:12+08:00",
  "content_type": "poster",
  "clean_text": null,
  "asset_refs": [
    {
      "asset_id": "247586-poster-01",
      "kind": "poster",
      "local_ref": "private://247586/poster-01",
      "sha256": "6130584ed81827c914e0c6910def99d752302b6accdb08209d5fa83363a9d71f"
    }
  ],
  "fetch_status": "processed",
  "failure_reason": null,
  "fetched_at": "2026-09-19T18:00:00+08:00"
}