{
  "schema_version": "article_bundle.v1",
  "notice_id": "240863",
  "title": "3月14日||“共美”沙龙—新疆维吾尔自治区定向选调经验分享",
  "source_url": "https://my.muc.edu.cn/notice/240863",
  "published_at": "2024-03-07 10:42",
  "content_type": "poster",
  "clean_text": null,
  "asset_refs": [
    {
      "asset_id": "240863-poster-01",
      "kind": "poster",
      "local_ref": "private://240863/poster-01",
      "sha256": "8ca71808e058a2ef02923e42bec781becfa7ed8f3e23050ed374e0895813efc4"
    }
  ],
  "fetch_status": "processed",
  "failure_reason": null,
  "fetched_at": "2026-09-19T19:50:51+08:00"
}