{
  "schema_version": "article_bundle.v1",
  "notice_id": "246757",
  "title": "11月26日||MUC“共美”沙龙—宁夏选调经验分享",
  "source_url": "https://my.muc.edu.cn/notice/246757",
  "published_at": "2026-09-18T22:19:13+08:00",
  "content_type": "poster",
  "clean_text": null,
  "asset_refs": [
    {
      "asset_id": "246757-poster-01",
      "kind": "poster",
      "local_ref": "private://246757/poster-01",
      "sha256": "1e74b1df36d2626c5664a478f9b0d59dcea8530be6b91d6983cd0104611ce1fb"
    }
  ],
  "fetch_status": "processed",
  "failure_reason": null,
  "fetched_at": "2026-09-19T18:00:00+08:00"
}