{
  "schema_version": "article_bundle.v1",
  "notice_id": "246193",
  "title": "10月31日||MUC“共美”沙龙——山东定向选调经验分享",
  "source_url": "https://my.muc.edu.cn/notice/246193",
  "published_at": "2026-09-18T22:19:14+08:00",
  "content_type": "poster",
  "clean_text": null,
  "asset_refs": [
    {
      "asset_id": "246193-poster-01",
      "kind": "poster",
      "local_ref": "private://246193/poster-01",
      "sha256": "c33d4c220c92eb093ccc72a1a5c6db7a024d5c51b12123e0c708c27a1551a0f9"
    }
  ],
  "fetch_status": "processed",
  "failure_reason": null,
  "fetched_at": "2026-09-19T18:00:00+08:00"
}