{
  "schema_version": "article_bundle.v1",
  "notice_id": "239151",
  "title": "12月19日||“共美”沙龙——湖北选调经验分享",
  "source_url": "https://my.muc.edu.cn/notice/239151",
  "published_at": "2023-12-15 13:35",
  "content_type": "poster",
  "clean_text": null,
  "asset_refs": [
    {
      "asset_id": "239151-poster-01",
      "kind": "poster",
      "local_ref": "private://239151/poster-01",
      "sha256": "b462a05751531214b3dcfecddb235efb26e0228cf69866af86500144f34b4d7c"
    }
  ],
  "fetch_status": "processed",
  "failure_reason": null,
  "fetched_at": "2026-09-19T19:50:55+08:00"
}