{
  "schema_version": "article_bundle.v1",
  "notice_id": "247035",
  "title": "12月4日||MUC“共美”沙龙——福建选调经验分享",
  "source_url": "https://my.muc.edu.cn/notice/247035",
  "published_at": "2026-09-18T22:19:13+08:00",
  "content_type": "poster",
  "clean_text": null,
  "asset_refs": [
    {
      "asset_id": "247035-poster-01",
      "kind": "poster",
      "local_ref": "private://247035/poster-01",
      "sha256": "ef1e062fa12da9d4d22e861dc38bc398da595bd42bb330ce65927378e378cc85"
    }
  ],
  "fetch_status": "processed",
  "failure_reason": null,
  "fetched_at": "2026-09-19T18:00:00+08:00"
}